,adult,backdrop_path,genre_ids,id,original_language,original_title,overview,popularity,poster_path,release_date,title,video,vote_average,vote_count
333,False,/mSLykhhSyfTpWG6a5PCQnjzvCBs.jpg,[99],44639,en,Inside Job,"미국 리먼 브라더스의 파산 신청과 최대 보험사 AIG의 몰락은 미국 경제를 뒤흔들었다. 월 스트리트 쇼크로 글로벌 주식 시장은 그 즉시 휘청거렸다. 전 세계는 수십 조 달러의 빚더미에 올라앉았고 경제 침체는 계속되었다. 집 값과 자산은 대폭락했고, 3천만 명이 해고됐으며, 5천만 서민들은 극빈자가 되었다. 세계 경제를 파탄으로 내몰았지만… 여전히 돈과 권력을 손에 쥐고 있을 주범들은 과연 어디 있는가.",12.301,/6sm3DAkzyTU6Ty4PozSqSbeRQqF.jpg,2010-10-08,인사이드 잡,False,7.7,696
334,False,/38zLaycGTVCMyyF9x393ds048JF.jpg,"[27, 9648]",43931,en,My Soul to Take,,9.749,/aPbR3auoJJ7cvOofQGw4NWm7OTf.jpg,2010-10-08,My Soul to Take,False,5.6,389
335,False,/l7gkk5K0NnVSqZ0Qr4zkNskH9AC.jpg,"[35, 18]",43923,en,It's Kind of a Funny Story,"내가 뭘 할거냐구? 난 그냥 살거야. 그것도 의미가 있으니까... 평범해 보이는 고교생 크레이그는 우울증과 자살 충동에 고민하다가 스스로 병원 응급실을 찾는다. 의사는 통원 치료를 권하지만 크레이그는 자신의 상태가 아주 심각하다면서 입원하기를 원하고 결국 의사도 허락한다. 사실 크레이그는 스트레스성 구토, 절친과 사귀는 짝사랑 하는 여자친구 문제, 그리고 일주일 후면 시작될 여름학기를 떠올릴 때마다 앞으로의 일들이 걱정해 왔다.  청소년 병동 리노베이션으로 성인병동에서 생활하게 된 크레이그. 자신과는 좀 달라 보이는 다른 환자들을 보고 겁이 난 크레이그는 바로 퇴원하기를 원하지만 담당의사는 일주일 후 경과를 본 후 퇴원을 결정하겠다고 한다. 크레이그는 그곳에서 6번이나 자살을 시도했던 바비, 비사회적응자 무끄타다 등을 여러 사람들을 만나게 되고 그 속에서 자신을 발견해나가는데...",25.146,/jAIoL0275PFrx9jrmneWAqmBvtD.jpg,2010-10-08,잇츠 퍼니 스토리,False,7.0,1936
336,False,/f6hL1S6BITYuZtZpcTRiqQW1vIp.jpg,"[12, 35, 10751, 14, 10770, 27]",63700,en,My Babysitter's a Vampire,,11.332,/dUWPPf9kCmnO5TxP08zsa6u0YmP.jpg,2010-10-09,My Babysitter's a Vampire,False,6.9,303
337,False,/uYeO6MkVSTG2K8g4yXskTf3unLC.jpg,"[27, 28, 53, 878]",44678,en,Altitude,"비행기 사고로 어머니를 잃은 ‘사라’는 아버지의 반대에도 불구하고 친구들을 태우고 첫 비행을 감행한다. 경미한 고장으로 경로를 이탈한 비행기는 폭풍우를 만나 정체를 알 수 없는 구름 속으로 빨려 들어간다. 긴급한 상황을 극복하려는 ‘사라’와 그녀의 친구들, 그렇지만 정체를 알 수 없는 죽음의 그림자가 그들의 앞길에 드리우기 시작하는데…. 그들은 과연 살아남을 수 있을 것인가?",8.249,/1MhCLk4TzLAQmj7SfUWO7X2iWQP.jpg,2010-10-10,앨티튜드,False,4.8,177
338,False,/A7JLOMnim2y26Vt06vwvz7HmORM.jpg,"[10751, 12]",48844,en,The Search for Santa Paws,"크리스마스가 다가오자 다시 분주해진 산타 마을. 산타는 1600살 생일을 맞이하여 더욱 더 들뜨고 즐거운 기분이다.  그때 산타의 오랜 친구인 허클버클 영감이 사망했다는 소식이 들려오고 산타는 슬픔에 빠진다. 슬픔에 빠진 산타클로스를 달래주기 위해 요정 일라이는 인형이었던 강아지 포스를 진짜 강아지로 만들어 준다.  허클버클 가게가 있는 뉴욕으로 간 산타클로스와 포스는 우연히 교통사고를 당하고 산타클로스는 기억을 잃게 된다. 한편, 새로운 고아원에 맡겨진 퀸은 크리스마스의 마법을 믿고 있는 작은 소녀. 그녀는 허클버클 가게에서 산타클로스를 보게 되고, 산타에게 소원을 말하게 되는데...",18.044,/rW6rXvT6AeNC4AUBC2HJiiLpwly.jpg,2010-10-12,산타포스를 찾는 모험,False,6.2,153
339,False,/omUvDkT8IYJPYuiENmFvNiGtIXE.jpg,"[28, 12, 35, 80, 53]",39514,en,RED,"CIA 사상 최고의 특수요원 프랭크. 정체를 알 수 없는 무장 괴한들의 습격을 당한 그는 상상조차 하지 못할 거대한 위협을 직감하고, CIA 최고의 두뇌 조와 폭탄 전문가 마빈, 킬러계의 대모 빅토리아와 함께 힘을 합치기로 한다. 한편, CIA 특수 요원 쿠퍼는 살려두기에는 너무 위험한 실력자, 일명 레드를 제거하라는 특별 지령을 받고 이들을 맹추격하기 시작한다.",21.702,/w3ZhqsxJwxXLTZYK2Yzm0AG5en6.jpg,2010-10-13,레드,False,6.7,5495
340,False,/gVBXL3je3fxQBFwAoTPWTXGXQXp.jpg,[27],47763,en,The Shrine,"동유럽 폴란드에서 실종된 남자의 이야기에서 수상함을 느끼는 카르멘(신디 샘슨)과 사라(메간 허펀). 그녀들은 그 사건에 대해 흥미를 느끼고 직접 조사해보려고 하고 그녀들의 이 위험한 여정에 카르멘의 남자친구 마르쿠스(아론 애쉬모어)도 동행하는데, 그들이 찾아간 외딴 곳의 위치한 마을은 음산한 분위기가 가득 느껴지며 무언가 비밀을 숨기고 있는 곳이었다. 과연 그 마을에서는 무슨 일이 벌어지고 있는 것인가?",7.67,/pO74Qi0kNbJVWB1lSRiri96QOr8.jpg,2010-10-14,더 쉬라인,False,5.5,161
341,False,/vkBMhUSaDUk3JUCS2VUk160IXMM.jpg,"[16, 14, 10751, 12, 35, 10770]",47626,en,Legend of the BoneKnapper Dragon,,16.961,/fZHv7GYkS9wnalxvQ2G3ek8ZU3D.jpg,2010-10-14,본내퍼 드래곤의 전설,False,6.7,167
342,False,/r48vi3MHEO96ZWRDylIfUZQXwZN.jpg,"[27, 53]",71622,es,Atrocious,"스페인 경찰은 살인사건 수사에 단서를 제공할 37시간의 자료를 발견했다고 발표한다. 자료에는 한 가족이 별장에서 휴가를 보내는 모습이 담겨 있고, 남매는 섬뜩한 도시괴담을 조사한다. 조사 할수록 별장 주변에 알 수 없는 일들이 일어나고, 잔혹의 강도는 점점 커진다.  스타일의 다큐 촬영기법이 활용된 긴장감을 고조시키는 리듬감이 탁월. 마지막 반전은 경악할 정도",6.455,/lVzWJ0xV6AJxsHwL2KcdIbaNNeV.jpg,2010-10-15,시체스 별장의 공포,False,5.5,131
343,False,/7Gu4Qw1Xwku1hsdg0dD4weiLSA9.jpg,[27],56937,no,Fritt vilt III,"눈보라가 내리치는 산장. 그 곳은 아버지로부터 상습적인 폭행과 감금을 당하는 소년 거너가 살고 있는 곳이다. 거너의 부모는 그를 죽이려고 했지만 욘의 도움으로 그는 살아나게 된다. 그리고 거너는 부모를 찾아가 잔인하게 복수한다. 그로부터 12년 후 6명의 젊은이들(시리, 누트, 시몬, 헤다, 앤더스, 마그네)이 그 곳에 캠핑을 온다. 누트는 산장에서 12년 전 한 아이가 실종되었으며 그 후 그의 부모도 사라졌다는 이야기를 해준다. 산장을 둘러보던 시리는 오싹함을 느끼게 되고 친구들과 함께 숲에서 야영을 하기로 한다. 한밤 중 밀애를 즐기기 위해 숲으로 들어간 시리와 누트는 살인마가 설치한 구덩이에 빠지게 되고 살인마의 광란이 시작되는데…",10.307,/o3msCYVZXBNKcuKd8G8PyRoDTrw.jpg,2010-10-15,프릿 빌트 - 더 비기닝,False,6.0,108
344,False,/s2zzIS4UmrkrCWU8dT603KaEAFR.jpg,"[9648, 14, 35, 12]",47533,en,Scooby-Doo! Curse of the Lake Monster,,31.835,/4fvCOntbgzZ9crbduTHRhgN8bgq.jpg,2010-10-15,스쿠비-두! 커즈 오브 더 레이크 몬스터,False,6.2,377
345,False,/ta1KuiThmEqVkW2kvOeOHmKIpmn.jpg,"[35, 99, 28]",16290,en,Jackass 3D,"하늘로 내동댕이! 무서워? 그래도 웃기지?  화장실! 더러워? 그래도 웃기지?  얻어 터져서! 아파? 아프다고?  그래도 웃기지?  거봐~!! 이미 웃고 있잖아~!!  불가능이란 없다! 하늘을 나는 제트 스키!  하늘을 나는 새가 부러웠던 인류의 소망을 이루고자 그들이 나섰다. 최고 속력으로 물살을 가로지르는 제트스키. 수영장에서 제트스키가 도움닫기 한 순간 점프대 위를 힘껏 날아오르는 한 남자가 있다! 비교불가! 하늘을 나는 짜릿함 쾌감을 맛보시라!  거대한 싸대기? 최고의 하이파이브!  늘 지나던 장소, 익숙한 그 곳에 거대한 손이 나타났다! 모퉁이를 돌면 하이파이브가 기다리고 있다. 서류를 챙겨가던 사람도, 동료들에게 줄 수프를 가져가던 사람도 하이파이브를 피해갈 수 없다. 그들이 거대한 손을 당기는 순간 기절할 것이니…. 피할 방법은? 물론 없다! 그냥 즐겨라!  상상초월! 하늘로 솟구치는 화장실!  응가가 튀어오르는 화장실이 있다면?! 이제는 화장실을 날려버리는 도전에 나섰다. 그것도 화장실 변기에 사람이 앉은 채로. 언제 날아갈지 모르는 불안한 그 순간, 화장실이 하늘로 솟구친다. 물론 배설물도 역류한다. 눈 앞에 펼쳐지는 갈색 이물질(!)의 향연! 스크린으로 악취가 느껴질 것만 같은 리얼한 비주얼 쇼크를 경험하고 싶다면 강력 추천!  즐거운 폭발! 행복한 지금!  무방비 상태에서 지금 당신이 있는 공간이 파괴된다. 피할 길이 없다. 그냥 궁금해서, 재미있을 것 같아서 폭파를 감행한 그들! 빵~ 빵~ 터져도 좋아~! 무섭냐고? 재밌잖아~!",54.926,/538rTVeHoEmhDxUZDfEwmL664Ca.jpg,2010-10-15,잭애스 3D,False,6.6,1013
346,False,/iSnZqhy56hiVEIRzrmwer7qoiSR.jpg,"[12, 14]",12444,en,Harry Potter and the Deathly Hallows: Part 1,"덤블도어 교장의 죽음 이후, 마법부는 죽음을 먹는 자들에게 점령당하고 호그와트는 위기에 빠진다. 성년이 되며 해리를 지켜주던 수호 마법은 사라지고 해리와 론, 헤르미온느는 볼드모트 영혼의 조각이 보관된 호크룩스를 찾아 파괴하기 위한 모험을 떠난다. 그러나 이미 볼드모트에 의해 장악된 마법세계에서 죽음을 먹는 자들을 피해 숨어다니는 것만으로도 쉽지 않다. 세 사람에게 남겨진 덤블도어의 유품은 수수께끼처럼 그저 막막하고, 아무런 단서도 없이 떠난 그들의 모험은 불안과 초조함으로 가득하다. 계속되는 시련의 나날 속에 세 친구는 끊임없이 서로에 대한 믿음과 숙명에 대한 의지를 시험받는다.",253.198,/lOXvz8HrgOkp7AXGQp1APKeZqag.jpg,2010-10-17,해리 포터와 죽음의 성물 1,False,7.8,15244
347,False,/tGpJAfSwqpXjARSRrAWUiouUSnr.jpg,"[27, 9648, 53]",46441,en,Mirrors 2,"비오는 날 밤, 약혼녀를 태우고 차를 운전하던 맥스는 사고로 약혼녀를 잃고 혼자 살아남는다. 그 후로 환영을 보게 된 맥스는 메이플라워 백화점의 대표인 아버지의 부탁으로 개점을 준비하고 있는 백화점의 경비원으로 취직하게 된다. 하지만 백화점에 있는 대형 거울에서 여자의 혼령을 본 맥스는 전임 경비원이 자신의 얼굴을 스스로 베고는 그만두었다는 얘기를 듣는다. 그리고 백화점 직원이 차례로 죽게 되는데, 이 일이 두 달 전에 실종된 엘리노어 레인즈와 연관이 있음을 알게 되는데...",24.34,/gDr5TaM129kUNwXkUUZ7Cha2CNn.jpg,2010-10-18,미러 2,False,5.6,299
348,False,/aDKuDfEAYa2VENKd155D4ZoAl7c.jpg,"[35, 18]",48034,fr,Les Petits Mouchoirs,"매년 프랑스 남부 해변가 맥스(프랑수아 클루제)의 호화로운 별장에서 휴가를 함께 보내는 개성만점 8명의 친구들. 하지만 휴가를 하루 앞둔 어느 날, 파리에서 바이크 드라이브를 즐기던 루도(장뒤자르댕)가 갑작스런 교통사고로 사경을 헤매게 되고 모두를 혼란에 빠뜨린다. 불안함과 공허함, 그리고 각자 비밀들을 감춘 채 그 해 예정되어 있던 2주간의 특별한 여행을 떠나게 되는데…",11.737,/VPITaNvzSD0bvxhYaUk72IRmf5.jpg,2010-10-20,프렌즈 : 하얀 거짓말,False,7.1,1234
349,False,/s1r2aBDzkvlFkNnAgxWFTCQjKPe.jpg,[18],45958,es,Biutiful,"나는 마약을 사고 팔고 밀입국자들을 짝퉁가방 공장에 알선하는 인력브로커다.  고질병 때문에 찾아간 병원에서 암이란다. 남은 시간 3개월… 엄마의 우울증 때문에 못난 아빠와 함께 사는 나의 착한 두 아이는, 아직 어리다.  죽은 자와 대화할 수 있는 나의 특별한 능력은… 불행히도 나의 죽음을 보게 한다.  너무나 많은 이들에게 끔찍한 죄를 저질렀다. 마지막 순간, 실패한 인생이라 불릴 것이다.  하지만 내가 태어나기도 전에 죽은 얼굴도 모르는 아버지를 여전히 그리워하는 것처럼,  험한 세상에 남겨질 나의 아이들에게는 좋은 기억을, ‘아름다운’ 세상을 선물하고 싶다.  3개월 한달 하루 한 시간 일분… 나의 아이들아, 미안하다…  그럼에도 불구하고.. 살아야 한다.",8.883,/zeMqVJYEWCxt68YeEM1dr8wCHSp.jpg,2010-10-20,비우티풀,False,7.3,842
350,False,/iHSfsJBiQUkaMukRaOopdVBkrnX.jpg,"[27, 9648]",41436,en,Paranormal Activity 2,"다니엘과 크리스티는 딸 알리, 어린 아들 헌터와 함께 단란한 가정을 꾸리고 산다. 그러던 어느 날, 그들의 평온한 집이 마치 도둑이 든 것처럼 아수라장이 된다. 다니엘은 가족들을 안심시키고 또 다른 침입자가 발생할 경우를 대비해 집안 곳곳에 CCTV를 설치한다. 현관 밖과 안, 거실, 부엌, 헌터의 방, 수영장 등 총 6대의 CCTV는 이제 가족들의 평범한 일상 생활을 조용히 촬영한다. 그러나 하루, 이틀 지나면서 가족들이 잠든 사이, 적막한 CCTV 화면에 서서히 미스터리 한 일들이 촬영된다. 허공을 바라보는 아이, 홀로 움직이는 모빌, 수영장 밖으로 나와 있는 청소기, 개의 갑작스러운 발작... 이제 그 모든 미스터리의 진실이 밝혀진다!",26.69,/3FLzxk1hT5MNbKRaxW0iToLWUmL.jpg,2010-10-20,파라노말 액티비티 2,False,5.8,1903
351,False,/s8yci6PDCs0wQljciud2Z3QFyzp.jpg,"[12, 16, 10751, 35]",51170,en,Open Season 3,"부그는 그의 절친들과 함께 시간을 보내기 위해 연례적인 총각 여행을 계획한다. 하지만 그의 가장 친한 친구인 엘리엇이 가족을 꾸리면서 부그로부터 멀어지기 시작한다. 다른 친구들 역시 가족들과 시간을 보내고 싶어하자 부그는 혼자서 여행을 떠나야 된다는 사실에 큰 실망감을 느낀다. 외로움에 지친 부그는 여행 도중 러시아 서커스 유랑극단에 합류하게 된다. 서커스단에서 부그는 만년 조연 역할에 지쳐있던, 게으르고 지저분한 회색곰 두그를 만난다. 두그는 유아독존의 숲의 제왕이 되어 야생의 지배자로 인정받기를 언제나 갈망하고 있었다. 부그는 두그를 만나서 기쁘지만 부그에게 숲에서의 그의 삶과 서커스 단원 자리를 서로 맞바꿀 것을 제안하고, 부그는 그 제안을 받아들인다. 하지만 곧 이 모든 것이 탈출에만 혈안이 되어있던 두그의 사기극임이 밝혀진다.  한편 부그는 러시아 출신의 외줄타기 단원으로 저글링과 춤에 천부적인 재능을 지닌 암컷 회색곰 우르사와 깊은 사랑에 빠진다. 그들에 커플로 함께 일하기 시작하면서, 처음 예상과 달리 손발이 척척 맞는 듀엣으로 점차 인정받는다. 한편 부그가 사라진 것을 알게 된 부그의 친구들은 부그와 그의 진실된 사랑 우르사를 서커스 단에서 구해내기 위한 대대적인 구조작전을 펼친다.",15.576,/qEr9fkGLQUWcAnVfDV46L79bdFs.jpg,2010-10-21,부그와 엘리엇 3,False,5.7,418
352,False,/4iQ1BLft7WpJBBuPM91SMvO7FGO.jpg,[18],44129,en,The Company Men,"선박 운송 파트의 영업 부장으로 승승장구하던 바비, 한 직장에 30년간 충성을 바쳐 온 필, 대주주이자 창립 멤버로 부사장을 역임했던 진은 회사의 갑작스러운 구조조정으로 인해 하루 아침에 일자리를 잃고 충격에 휩싸인다. 경영학 석사 출신의 바비는 자신만만하게 여유를 부리며 일자리를 알아보지만, 연거푸 재취업에 실패하면서 차가운 현실을 절감하고 생각지도 않았던 목수 일을 시작한다.  대학생 자녀를 둘이나 둔 필은 재취업을 위해, 자존심을 접고 인맥을 총동원해 보지만 예순을 바라보는 그에게 사회는 차갑게 등을 돌린다. 바비나 필과는 달리 보유한 주식만으로 여유롭게 살고자 했던 진. 그러나 그에게도 남은 인생을 바꿀 충격적인 사건이 일어나는데…. 각자의 방식대로 실업의 위기를 헤쳐 나가는 세 남자, 그들은 어려움을 극복하고 새로운 인생을 시작할 수 있을까?",14.378,/rr6nST3UyC1WlrUCDalXcbKP9cG.jpg,2010-10-21,더 컴퍼니 맨,False,6.5,531
353,False,/la1iVfLuZXaaA9FGRe9xqp8Ou7y.jpg,"[27, 80]",41439,en,Saw 3D,"후계자에서 생존자로 처지가 바뀐 호프만은 자신을 죽이려 한 직쏘의 아내 질을 뒤쫒고, 직쏘의 트랩에서 처절하게 살아남은 바비는 ‘생존’이라는 책을 써내 전국적인 베스트 셀러 작가가 된다. 또한, 바비는 다른 생존자들을 모아 직쏘가 그들의 몸과 영혼에 남긴 상처를 치유하기 위해 노력한다. 그러나, 직쏘도 후계자들도 모두 죽거나 혼돈에 빠진 이 순간 어디선가 여전히 직쏘의 게임이 진행되고 그것은 생존자 그룹을 겨냥하고 있는데…",30.696,/zpegyeSIcKXVnhiHTRKlZdEEKiV.jpg,2010-10-21,쏘우 3D,False,6.0,2232
354,False,/1tmcsKQo0QzAzpvm1Akmkmxstjq.jpg,"[10751, 14, 27, 10770]",48186,en,The Boy Who Cried Werewolf,,9.138,/i7lny9FF2ylyPDwdF70ImmSbOv3.jpg,2010-10-22,The Boy Who Cried Werewolf,False,6.4,239
355,False,/f2z00VIPyrrfFabw0RnoY5M8uYt.jpg,"[18, 14]",44603,en,Hereafter,"미국에 살고 있는 ‘조지’는 평범한 듯 보이지만 사후세계와 소통할 수 있는 특별한 능력을 지니고 있다. 하지만 스스로가 원하지 않은 능력 때문에 사랑하던 여인마저 떠나 보내고 남모를 고통을 겪는다. 지구 반대편 프랑스에서 갑작스런 쓰나미에 죽음의 문턱까지 가는 경험을 한 ‘마리’는 그 후 사후세계를 파헤치며 보이는 사실만을 믿던 기자로서의 삶에 커다란 변화를 맞이한다. 한편, 런던의 소년 ‘마커스’는 사고로 자신의 반쪽과 같은 쌍둥이 형을 잃고 삶 저편 세계에 대한 해답을 간절히 찾아 헤맨다.  각기 다른 방식으로 죽음을 접하고 각자의 진실을 찾던 세 인물은 우연히 한 시점에서 만나게 되고, 죽음이 이들에게 가져다 준 세 가지 삶의 기적은 그들을 믿을 수 없는 곳으로 이끄는데…",11.783,/flTGLjXM4l6KtZki5hW0vjICCqK.jpg,2010-10-22,히어애프터,False,6.0,1276
356,False,/lQ5rAuqg3isxXAFTxueaXPsH2CS.jpg,"[35, 18]",46829,en,Barney's Version,당신에겐 있었나요?  잡고싶은 단 한사람  사랑...그 이상의 감동을 만나다,13.654,/5Zk9AYPtacGiMnnd2q8mFfDe8ks.jpg,2010-10-26,세번째 사랑,False,7.1,329
357,False,/tCKmhgt72QgfbyDb3S6FL6m9Wd3.jpg,[99],72721,es,Nostalgia de la luz,"칠레의 3,000미터 고도, 아타카마 사막에 전 세계에서 온 천문학자들이 별을 관찰하기 위해 모인다. 하지만 그곳에는 독재 정권 아래 정치범들의 유해도 있다. 천문학자들이 어딘가에 존재할지도 모를 생명체를 찾아 멀리 떨어져 있는 우주를 관찰하는 동안 관측소기슭에서 여자들은 사막의 흙을 파내며 사라진 친척들을 찾는다. (2016년 제13회 서울환경영화제)",5.604,/jJLE4FL0xx2MjhpIqsvcOptJaS9.jpg,2010-10-27,빛을 향한 그리움,False,7.5,108
358,False,/pHnGbmHyueklsZ92EsWP5cQQhFY.jpg,[35],56014,it,Maschi contro femmine,,12.879,/epD9iEIEwwY3cYMyThw6Unn3gJv.jpg,2010-10-27,Maschi contro femmine,False,5.8,601
359,False,/x3SaO6DMfVWzil80Qd4xl2UBsff.jpg,"[35, 10749]",53844,fr,Il reste du jambon ?,,4.419,/1lDp0URhZtSlsmRDIOt2dMdMC6a.jpg,2010-10-27,Il reste du jambon ?,False,5.0,130
360,False,/oDcofzQTU2p9ZpB3UyrbWjUrgOa.jpg,"[14, 18, 27, 10749]",52587,de,Wir sind die Nacht,"좀도둑질로 생활을 이어오던 ‘레나’(카롤리네 헤어퍼스)는 우연히 찾아 가게 된 클럽에서 뱀파이어 ‘루이즈’(니나 호스)의 눈에 띄어 목을 물리게 된다. 다음 날, 자신의 몸이 이상해진 것을 알게 된 그녀는 어두운 밤에 다시 클럽을 찾아가고, 그곳에서 ‘샤롯’(제니퍼 울리히)’과 ‘노라’(애너 피셔)를 만난다.  영겁의 세월을 거친 그녀들과 한 무리가 된 ‘레나’는 자신의 존재를 있는 그대로 받아들여주는 진정한 사랑 ‘톰’(막스 리에멜트)을 만나게 되지만 자신 때문에 그가 위험에 처하게 됨을 깨달은 그녀는 돌이킬 수 없는 선택을 하게 되는데...",7.726,/eLIWQrjCcsn1oJeVAjwFj6VatNZ.jpg,2010-10-28,위 아 더 나이트,False,6.2,190
361,False,/toSNGrfYL2OZzvekTPuWyAlzG7e.jpg,[18],52505,en,The Other Woman,,9.434,/bL7E576TENzL2d59HiXkXcEhy9N.jpg,2010-10-28,디 아더 우먼,False,6.2,304
362,False,/9QXx4tS65s3oUBoQ27bMIwmBD9x.jpg,"[16, 35]",48466,en,Scared Shrekless,,12.948,/aAQQJhX8NqKZ7ZNDUPQQKi1wK8h.jpg,2010-10-28,스케어드 슈렉레스,False,6.4,296
363,False,/irpJXGiVr539uuspcQcNdkhS2lq.jpg,"[16, 28, 35, 10751, 878]",38055,en,Megamind,"메트로시티의 막강 라이벌 메트로맨과 메가마인드! 도시의 영웅 메트로맨과 달리 슈퍼 악당 메가마인드는 모든 사람들이 두려워하는 대상. 그러던 어느 날... 꼭 한번 메트로맨을 이기고 싶었던 메가마인드는 회심의 일격을 가하고 얼떨결에 메트로맨을 제거하는데 성공한다. 하지만 승리의 기쁨도 잠시! 앙숙이자, 숙적이자, 자신을 대적할 유일한 상대였던 메트로맨이 사라진 후 메가마인드는 예상치 못한 무료함에 점점 시들해져 가는데...  관심 받고싶은 슈퍼악당, 안티히어로 메가마인드! 영웅을 제거해버린 그의 기상천외한 다음 계획은??",78.455,/889qsylbt5Y1TGnwaiKiCcEDaIh.jpg,2010-10-28,메가마인드,False,6.9,5316
364,False,/ssItdIRiqJ0PReGtKkFK8qQccnz.jpg,"[27, 53]",52274,es,Los ojos de Julia,"선천적 시력장애로 고통 받고 있는 줄리아는 같은 증세로 이미 시력을 상실한 쌍둥이 언니 사라의 죽음에 큰 충격을 받는다. 언니의 자살에 의문을 품은 그녀는 남편의 만류에도 불구하고 주변을 조사하기 시작한다. 기묘한 분위기의 수상한 이웃들과 정체를 알 수 없는 사라의 남자친구, 무언가 감추고 있는 듯한 남편의 이상한 행동들… 파헤칠 수록 의혹은 더욱 커져만 가고, 그러던 중 남편의 실종으로 더욱 큰 불안감에 휩싸이게 된 줄리아. 그녀의 시력은 점점 악화되기 시작하는데….",13.916,/5TSQv7REzMvHc8BAQvSUtqs9Eqo.jpg,2010-10-29,줄리아의 눈,False,6.6,603
365,False,/bvUsxlnOEATldJR808r4T2t1VIm.jpg,"[35, 53, 36, 27]",50204,en,Burke & Hare,"시체 처리로 골머리를 앓던 두 콤비, 에든버러 의과대학에 해부용 시체로 팔아 넘기는데… 어라, 그 수입이 짭짤하다. 돈맛을 잊지 못한 버크와 헤어는 시체 브로커를 자처하며 시체를 찾아 나서다 연쇄살인까지 저지르게 되는데… 연쇄살인으로 본의 아니게 영국 의학계의 발전에 기여(?)한 버크와 헤어의 최후는 어떻게 될까?",8.872,/kJgVyuHpgHMDoB7IyCrz8zEtPJU.jpg,2010-10-29,버크 앤 헤어,False,6.1,362
366,False,/8dI1r7qh7sT79ZkkvhTKFwAIuV1.jpg,"[14, 27]",46146,nb,Trolljegeren,"노르웨이 정부는 단지 숲 속의 곰이 문제를 일으키는 것뿐이고 상황이 심각하지 않다며 국민들을 안심시킨다. 그러나 지역 사냥꾼들은 정부의 발표를 믿지 않고, 세 명의 대학생 또한 이상한 낌새를 눈치채고 직접 진실을 밝히고자 한다. 그들은 비디오카메라를 들고 수수께끼로 가득 찬 “밀렵꾼”의 발자취를 쫓는다. 학생들은 자신들을 멀리 하는 밀렵꾼을 끈질기게 추적하고 마침내 그가 노리던 트롤과 마주하게 된다. 그리고 밀렵꾼이 실제로는 트롤 헌터라는 사실을 알게 된다. 전설에서만 존재한다고 믿어졌던 트롤의 비밀을 파헤치기 위해 목숨을 건 학생들은 트롤 헌터의 모든 움직임을 쫓아 기록하기 시작한다.",15.05,/oPzErFPLpzrk8Lp3bDGWoRZOJ7H.jpg,2010-10-29,트롤 헌터,False,6.7,1200
367,False,/aKess0g91BMSYpq1VLqwaqz83JF.jpg,[18],31007,en,Welcome to the Rileys,"편안한 집에서 풍족한 생활을 하는 로이스(멜리사 레오)와 더그(제임스 갠돌피니). 하지만 8년 전의 깊은 상처로 인해 로이스는 집 밖으로 나가지 못하고, 더그는 그런 그녀와 소통하지 못한다. 그러던 어느 날, 로이스는 출장을 떠난 더그로부터 당분간 집에 돌아오지 않겠다는 전화를 받고 그를 찾아 나서게 된다.  8년 만에 다시 세상과 마주하며 두렵지만 설렘과 희망을 느끼는 로이스. 하지만 남편이 어린 스트립 걸(크리스틴 스튜어트)을 돌봐주며 지내고 있다는 사실을 알게 되면서 그녀는 큰 혼란에 빠지는데……  뜻밖의 만남이 가져다 준 새로운 삶을 시작할 수 있는 위로와 용기!",13.835,/tt9pBPoXjFu36rPqObwrgkYCY3t.jpg,2010-10-29,웰컴 투 마이 하트,False,6.6,323
