,adult,backdrop_path,genre_ids,id,original_language,original_title,overview,popularity,poster_path,release_date,title,video,vote_average,vote_count
202,False,/sRJBQVx3UzoT77yt4NVFCIYfnPh.jpg,"[14, 12, 28]",27022,en,The Sorcerer's Apprentice,"현대 과학이 집결된 최첨단의 도시 맨하탄. 이 화려한 도시의 한쪽에는 한때는 누군가의 상상이었으며, 이제는 사람들의 손가락질을 받는 어느덧 환상 속의 신화가 되어버린 위대한 마법사 ‘발타자 블레이크(니콜라스 케이지 분)’가 살고 있다. 물론 그의 본업은 사악한 어둠의 마법사 ‘맥심 호르바스(알프레드 몰리나 분)’로부터 도시를 지키는 것.  전세계 어둠의 세력을 모으는 맥심을 물리치기 위해 발타자 역시 평범해 보이지만 엄청난 마법의 잠재력을 지닌 데이브(제이 바루첼 분)를 과감히 제자로 거둔다. 자신의 의지와는 상관없이 인류의 운명을 책임지는 임무를 맡게 된 데이브. 그러나 목숨이 왔다갔다하는 마법 훈련만으로도 모자랐는지 스승인 발타자는 사상 최악 어둠의 마법사 맥심과 지상 최대의 마법 전쟁을 시작한다.  다소 엉뚱하지만 분명 위대한 마법사 발타자와 더 없이 사악한 어둠의 마법사 맥심. 그들의 불꽃튀는 대결 속에서 마법사의 제자로 다시 태어난 데이브는 도시와 인류를 구원할 수 있을 것인가? 아니! 도시와 인류보다 자신의 목숨을 구할 수 있을 것인가?!",24.891,/h59GHE8xgQQRSl3V0Xu2rzxzpjq.jpg,2010-07-13,마법사의 제자,False,6.1,4074
203,False,/n4rEE6PiYG57qAQYmZpmsy5SuJ2.jpg,"[35, 10749]",38961,en,Tamara Drewe,,9.904,/9PNDZZyqFsLZAEp7mVfhO06OLmt.jpg,2010-07-14,Tamara Drewe,False,5.9,324
204,False,/ozDVHQRk0UU0SYYAan8qF18VGba.jpg,"[10749, 878]",59457,en,Womb,"할아버지가 살고 있는 바닷가 마을에 놀러온 어린 소녀 레베카는 그곳에서 소년 토미를 만나게 된다. 마음이 통한 둘은 매일을 함께하며 설레는 나날을 보내지만, 레베카가 집안 사정으로 도쿄로 떠나게 되면서 서투르고 그리운 이별을 맞이하게 된다. 12년이 흘러 다시 바닷가 마을을 찾은 레베카는 한시도 잊지 못했던 토미를 다시 만나게 되고, 어린시절의 추억을 공유하며 두 사람은 연인이 된다. 그러나 그들의 사랑은 갑작스런 사고로 영원한 이별을 맞이하게 되고, 토미가 없는 세상에 남겨진 레베카는 깊은 슬픔에 빠지게 된다. 토미가 너무나 그리웠던 그녀는 그의 유전자 조직을 채취해 토미의 복제인간을 낳기로 결심한다. 주변의 만류를 뒤로하고 아이를 낳아 키우게 된 레베카는 사랑의 상실감을 극복하며 다시 행복을 느끼게 되지만, 피할 수 없는 복잡하고 어려운 상황들과 직면하며 혼란을 느끼게 되는데…",10.182,/w98sx8jPYWeRZORdmgkmDMcBFuH.jpg,2010-07-15,움,False,6.1,262
205,False,/dKJM7ASnbe2owv92S4OwtqBG8wl.jpg,"[53, 18]",43549,en,The Experiment,"심리학의 권위, Dr. 톤은 인간의 본성을 파헤치기 위한 충격적 심리 실험을 위해 신문광고를 통해 참가자를 모집한다. 그리고 14일간 이들을 고립시키기 위한 거대한 미로 같은 지하 임시감옥을 셋팅한다. 연구자들은 감옥 곳곳에 카메라를 설치하고 실험자들의 모습을 감시할 것이다. 이 안에서 어떤 일이 일어나도 절대 연구자의 개입은 없다. 오직 실험실의 생쥐처럼 이들을 관찰하고 기록할 뿐이다.  이름대신 번호표를 달고 고개를 숙인 채 일렬로 걸어가는 죄수들과 곤봉을 차고 이들을 통제하는 간수들. 엄격한 심리테스트를 걸쳐 선발된 20명의 표본들 - 전직기자인 택시운전자 타렉, 7년간 한 번도 지각을 해 본적이 없는 항공사 직원 베루스, 엘비스 모창가수 등. 이들은 12명의 죄수와 8명의 간수로 나뉘어 14일간의 역할을 수행하면 된다. 실험 1일. 처음은 게임처럼 즐거웠다. 그러나 간수는 여섯 개의 규칙에 따라 죄수를 통제해야 한다. 실험 2일, 3일... 한 잔의 우유, 치기 어린 장난들이 점차 그들을 진짜 간수와 죄수로 몰아가기 시작한다. 실험 5일째. 결국 첫 번째 살인이 발생하고, 실험은 연구자의 통제를 벗어나 버리는데.",80.105,/aFjcGV0Qybrc8CQzUYuB9hwqRJ2.jpg,2010-07-15,엑스페리먼트,False,6.4,923
206,False,/s3TBrRGB1iav7gFOCNx3H31MoES.jpg,"[28, 878, 12]",27205,en,Inception,"타인의 꿈과 접속해 생각을 빼낼 수 있는 근미래, 돔 코브는 꿈의 보안 프로그래머이자 동시에 침입자다. 그는 일본인 사업가 사이토의 제안에 따라 거대 합병 기업의 총수가 될 피셔의 꿈을 설계하여 기업 합병을 막으려 든다. 그 일을 성사시키면 코브는 사이토의 도움으로 아내의 살해범으로 몰린 자신의 누명을 뒤로 하고 사랑스런 자녀들이 있는 집으로 돌아갈 수 있다. 마침내 코브 일행은 꿈 안의 꿈 안의 또 꿈이라는 경로를 거치며 피셔의 꿈과 무의식 깊숙한 곳을 설계하고 침투한다.",131.043,/jSm8mzp7sucgL8NwINIoAmx4dS5.jpg,2010-07-15,인셉션,False,8.3,30275
207,False,/8JVvASQeLEqNvWsczG8P2EjzMQN.jpg,"[80, 27]",55890,en,Bereavement,"느끼지 못한다면 두려움도 없다! 펜실베니아 주에서 연쇄살인범에 의해 납치된 한 소년 마틴. 그는 선천성 무통증으로 아픔을 전혀 느낄 수 없다. 연쇄살인범은 사람을 납치해 마틴 앞에서 살해하고, 원래 아픔에 대해서 무감각한 마틴은 계속되는 살인에 무감각해져 간다. 한편, 불의의 교통사고로 부모님을 여의고 삼촌네 가족과 살려고 시골로 온 앨리슨은 육상 선수의 꿈을 키운다. 그녀는 조깅 도중에 도축장 건물에서 마틴을 보고 그를 따라 안으로 들어가고, 살인 흔적과 범행이 적힌 일기를 발견한 앨리슨은 마틴을 데리고 밖으로 나가려 하는데…",10.162,/s9CkLGjEqv03xVhlqTTkW6IJKQ6.jpg,2010-07-16,사이코패스,False,5.2,124
208,False,/7Q27v2bavhnBOEp8R5dGYr7p4Yb.jpg,"[14, 16, 10751]",51739,ja,借りぐらしのアリエッティ,"교외에 위치한 오래된 저택의 마루 밑에는 인간들의 물건을 몰래 빌려 쓰며 살아가는 소인들이 살고 있다. 그들의 철칙은 인간에게 정체를 들키면 그 집을 당장 떠나야 한다는 것. 14살이 된 아리에티는 부모님의 도움 없이 홀로 인간 세상으로 뛰어든다. 첫 목표는 각설탕. 생쥐와 바퀴벌레의 방해 공작에도 무사히 각설탕을 손에 넣은 아리에티는 두 번째 목표인 티슈를 얻으러 간 방에서 요양을 온 소년 쇼우의 눈에 띄게 된다. 인간은 무서운 존재라고 생각했던 것과 달리 쇼우의 다정한 모습에 조금씩 마음을 열기 시작한 아리에티. 마루 밑 세계의 규칙을 어기고 쇼우에게 다가가던 어느 날, 아리에티 가족에게 예기치 않은 위험이 찾아오는데...",27.39,/cabIejNkFEgl0ireMpQ8BSlkNJ2.jpg,2010-07-16,마루 밑 아리에티,False,7.6,2056
209,False,/jb2i8OdcWP2gIF6dgtCA5JP7zC2.jpg,"[18, 10749]",72660,pt,Eu Não Quero Voltar Sozinho,,6.037,/c0dVfg5wwiYzlYl9QsmrtWiwM6d.jpg,2010-07-18,Eu Não Quero Voltar Sozinho,False,7.9,186
210,False,/fFQpxlqLpgk767MFQAwegkS7cHX.jpg,"[35, 10749, 10770]",62592,en,Revenge of the Bridesmaids,,6.755,/brwwPZzTWJWHv0cHWHGmwQTYNfJ.jpg,2010-07-18,Revenge of the Bridesmaids,False,6.6,242
211,False,/4gDWQZkmpzVLoNQlx7gXc6dDKRb.jpg,[18],41180,en,The Client List,"라일리는 싱글맘으로서 가족을 지키는 일과, 특별 손님을 받는 안마사로서의 일을 병행하며 둘 다 잘 해내려고 애쓴다.",10.714,/ucbfvXdzZFSpuybuNv3jThrr2Ow.jpg,2010-07-19,클라이언트 리스트,False,5.6,133
212,False,/jOpQjUqTgmiiYwesOEbTgxLlP75.jpg,[35],42189,en,Kevin Hart: Seriously Funny,,6.779,/xzmEzbqIS52IhfN7InU2KsljY04.jpg,2010-07-20,Kevin Hart: Seriously Funny,False,7.2,133
213,False,/1pX2IloFPEp1Pqrvru94LLzDLut.jpg,"[12, 28, 35, 53]",41135,en,Operation: Endgame,"미국 정부의 비밀스런 뒷처리를 담당하는 암살 첩보 조직인 'Factory'에 신입 요원인 'Fool'이 처음 출근한 날, 책임자가 살해당하면서 비밀 시설은 출입과 통신이 차단된 채 자체 폭발을 위한 2시간의 타이머가 작동된다. 조직 내의 상호 견제를 위해 구성된 알파와 오메가 팀원들은 살해의 음모를 밝히는 한편 2시간 안에 탈출하기위해 서로를 죽이며 사투를 벌이는데...",12.606,/ugbGBbzoPQXSgolQVVqRC3NGpIw.jpg,2010-07-20,오퍼레이션 엔드게임,False,5.0,144
214,False,/aMbwTo6JSmQdHR6NxkwM8Qfq22.jpg,"[10749, 35]",39285,en,Beauty & the Briefcase,,10.98,/zN9FYOXf5tUYjgget7yOzu8TlZU.jpg,2010-07-20,Beauty & the Briefcase,False,5.9,366
215,False,/75S1XsekIPF7c99g5cby0DeorPz.jpg,"[28, 9648, 53]",27576,en,Salt,CIA 요원 솔트(안젤리나 졸리)는 막 자수한 러시아 간첩을 심문하던 도중 도리어 이중첩자로 지목당하게 된다. 그의 증언에 따르면 구소련 시절 고도의 훈련을 받은 KGB 정예요원이 CIA에 침투해 있고 그 당사자가 솔트라는 것. 졸지에 그녀는 러시아 대통령과 미국 대통령을 암살할 위험인물로 낙인찍혀 버린다. 동료들의 의혹 속에 남편의 신변보호를 위해 탈출한 솔트는 그 동안 CIA 공작원으로서 익힌 모든 기술을 동원해 도주를 거듭한다. 그 과정에서 솔트를 중심으로 한 거대한 음모 역시 서서히 드러나는데...,88.931,/5vcTQ6RmoD3RVH9SZx7u1ZEgQUo.jpg,2010-07-21,솔트,False,6.4,4405
216,False,/AcRbkI2vyy7yVa57ObitTFTuYYV.jpg,[18],44560,zh,唐山大地震,"1976년 7월 28일 중국 당산.  인류 역사상 가장 끔찍했던 23초간의 대지진.  악몽 같은 지진은 한 가족의 운명을 송두리째 바꿔버렸다. 소박한 일상이지만 행복한 하루하루를 보내고 있는 일곱살 쌍둥이 ‘팡떵’과 ‘팡다’의 가족. 행복했던 그들에게 어느 날 갑자기 예고되지 않았던 시련이 닥친다. 바로 27만의 목숨을 빼앗아간 지옥 같은 대지진. 폐허가 된 도시, 수많은 생명이 죽음을 맞이한 아비규환의 현장에서 쌍둥이 남매는 극적으로 살아남지만 무너진 건물의 잔해 속에 묻히게 된다. 쌍둥이의 생존사실을 알고 구조대와 함께 아이들을 구하러 온 어머니는 자신의 목숨보다 소중한 쌍둥이 중 한 명만을 구해야 하는 운명의 선택 앞에 놓이게 된다. 가혹한 선택을 해야만 하는 어머니는 결국 아들인 ‘팡다’의 목숨을 선택하게 되고, 딸 ‘팡떵’은 죽음을 맞이해야 하는 채로 잔해 속에 남겨진다. 며칠 후, 죽은 줄로만 알았던 ‘팡떵’은 다른 구조대에 의해 발견되어 지진사망자 보관소에 버려지지만, 죽은 아버지 곁에서 기적적으로 살아나게 된다.  폐허가 된 지진의 잔해 속에서 살아남은 소녀.  한 순간 운명이 바뀌어버린 남겨진 소녀의 운명적인 이야기가 시작된다.",6.921,/anWknnT8w1hsDbDJhDiWKvOyck0.jpg,2010-07-22,대지진,False,7.2,119
217,False,/uDzecWucDpRHN77RTabU1KGBfQR.jpg,"[35, 10751]",38843,en,Ramona and Beezus,"독특한 상상력을 지닌 말썽꾸러기 초등학생 라모나 큄비(조이 킹)의 행복한 가정에 위기가 닥친다. 아빠가 갑자기 해고를 당한 것이다. 아빠는 파트타임으로 취직한 엄마를 대신해 집안일을 하면서 직장을 찾지만 쉽지 않고, 설상가상으로 주택 융자금 때문에 집마저 위태로운 상황이다. 라모나는 가족과 집을 구하겠다고 결심하고 레모네이드 판매, 세차 등에 나서지만 더 큰 사고만 치고 만다. 그때마다 비 이모(지니퍼 굿윈)와 그녀의 연인이었던 호바트 아저씨(조시 더하멜)가 라모나를 따뜻하게 감싸준다. 그러던 어느 날, 부모님이 이혼할지도 모른다는 생각 때문에 우울하기만 한 라모나에게 아빠는 아주 특별한 제안을 하는데...",9.892,/nBdwz67TKj9HDwpSxnCKIkXCQkp.jpg,2010-07-23,라모나 & 비저스,False,6.5,660
218,False,/3xnfbtgJmVotajqM57iKib3ftnT.jpg,"[878, 80, 28, 16, 9648]",40662,en,Batman: Under the Red Hood,"배트맨과 레드 후드를 소재로 한 2010년 비디오 영화이다. 저드 위닉이 쓴 배트맨 스토리라인 ""언더 더 후드""를 기반으로 각색되었으며, 레드 후드가 되어 살아 돌아온 로빈 제이슨 토드와 배트맨의 재회를 다루고 있다.",34.234,/dEujs48u3n4cmh15ITtHHDFxSaS.jpg,2010-07-27,배트맨: 언더 더 레드 후드,False,7.8,1171
219,False,/khTz78e5ZcN7J8DfWgRWrD7Wu7i.jpg,"[35, 10751, 28, 14, 12, 9648]",39691,en,Cats & Dogs: The Revenge of Kitty Galore,"인류를 위해 개와 고양이가 앞발을 잡았다! 이번엔 싸우지 말고 잘해보자, ‘개양이’ 연합작전!! 개와 고양이의 전쟁이 끝나고 잠깐의 휴전으로 찾아온 평화! 그러나 한 광기 어린 고양이가 복수의 발톱을 갈고 있었으니… 한때 고양이 스파이 조직에 몸 담았던 키티는 숙적인 개 종족은 물론 동료였던 고양이와 인간들까지 제거하고 자신의 자존심을 회복할 수 있는 음모를 계획한다. 야욕을 불태우는 키티 때문에 세상이 멸망할 위기에 직면하자 개와 고양이 종족은 동맹을 결심하고 역사상 전례 없는 연합작전을 펼친다.  세상을 위해 앞발을 맞잡은 그들, 드디어 털 날리는 미션 개파서블이 시작된다!!",26.504,/s9lSeJXeVZHToFFym8uhY4hYeOI.jpg,2010-07-28,캣츠 앤 독스 2,False,5.2,477
220,False,/irdYvAx7UwW8lvdkZWCLtdry07c.jpg,"[16, 12, 10751, 14]",44683,en,Tinker Bell and the Great Fairy Rescue,"픽시할로우에도 여름이 찾아오고 요정나라는 새로운 계절을 맞아 저마다 바쁜 날들을 보내고 있다. 요정들은 픽시할로우에서 벗어나 여름 캠프를 차리고 평소 호기심이 많은 팅커벨에게 친구들은 절대 사람들의 집 근처로는 가지 말라고 얘기한다.  어느 날, 비디아와 티격태격하던 팅커벨은 우연히 사람들의 자동차를 보게 되고 호기심이 발동한다. 자동차가 너무 궁금한 나머지 차 가까이에 가서 자동차를 자세히 관찰하는 팅커벨. 꼬마 소녀 리지는 요정들이 존재한다고 믿는 아이.  리지가 만들어 놓은 요정의 집을 발견한 팅커벨은 궁금증을 참지 못하고 들어가게 되고 같이 갔던 비디아의 장난으로 팅커벨은 리지에게 발각되고 만다.  리지는 팅커벨을 신기해하며 관찰하기 시작하는데...",29.131,/cb7PrVIYbwIadQqWxgSU6CGHJjj.jpg,2010-07-29,팅커벨 3: 위대한 요정 구조대,False,6.7,681
221,False,/zvMMye9YBD7sfcGyBEYSW6Lw4Ts.jpg,"[35, 18, 9648]",44718,en,Get Low,1930년대 미국 남부 테네시의 한 마을을 배경으로 합니다. 초로의 노인으로 홀로 살며 마을에서 떨어진 외딴곳에서 은둔생활을 하는 괴팍한 펠릭스 노인이 자신이 살아있는 동안 자기의 장례 파티를 열어 자신(펠릭스)의 얘기를 할 사람을 초대하기로 합니다. 하지만 정작 얘기를 하고 싶은 사람은 자기 자신이었다. 그에 관해 마을에서 전해지는 여러 가지 흉흉한 이야기의 진위를 떠나 마을 사람들은 모두 그를 기피하고 가까이 하기를 꺼린다. 이제 주변의 이웃들도 하나 둘 나이가 들어 세상을 떠나가고 세상에 남은 것은 이제 아무것도 없다. 그에 대해 제대로 아는 사람도 친구도... 그가 마을로 나타나자 마을은 온통 그를 경계하지만 그는 장의사를 찾아간다.  이 영화에서 get low는 죽어서 땅속에 묻히는 걸 말한다,11.194,/evNXQIY4lXBZCZIQE9QhdBjmAGF.jpg,2010-07-30,겟 로우,False,6.7,210
222,False,/5JPHQGtISh6TFQcZNwKsGLAuVAZ.jpg,"[53, 18, 28, 80]",40720,en,Twelve,젊은 마약 상인은 그의 사촌이 살해 된 후 그의 가장 친한 친구가 범죄로 체포되는 것을 본다.,12.586,/3OczJCk3OqcvJbQkFjp1pguTiuU.jpg,2010-07-30,트웰브,False,5.8,195
223,False,/2bNvoxVPyfiuNh7vmRvwePY5Paf.jpg,[35],38778,en,Dinner for Schmucks,"장래가 유망한 “팀”은 회사에서 인정받기 위해 해야 할 일이 하나 있다. 그의 상사가 주최하는 디너 파티의 게임에서 우승을 하는 것. 그 디너게임에서 승리하려면 가장 멍청한 얼간이를 파트너로 데려와야 한다. 운 좋게도 팀은 생쥐 미니어처를 제작하는 베리를 만나게 되고 그는 팀의 상상 이상으로 최고의 얼간이였다. 결국 둘은 함께 디너게임에 참가하게 되고, 멍청한 행동을 계속하는 베리 덕분에 디너파티는 최고조에 다다르게 된다. 그때 베리와는 앙숙인 서먼라는 제2의 얼간이의 등장으로 파티는 또 다른 방향으로 흘러가게 되는데……",32.791,/djwkUFhkM81gIsI9ZZ7I6ajZAKY.jpg,2010-07-30,디너 게임,False,5.6,1383
224,False,/dzx5vStQX4bHA1JBq8n5yLUqQx4.jpg,"[10749, 18]",37950,en,Charlie St. Cloud,"유명한 고교 요트 선수 찰리는 장학생으로 대학 입학을 앞둔 촉망 받는 청년. 졸업식을 마치고 큰 미래를 향한 꿈에 부풀어 있던 찰리는 예기치 못한 비극을 맞는다. 자신을 영웅처럼 여기는 어린 남동생 샘과 차를 타고 가다 큰 사고를 당하게 된 것. 두 형제 모두 심장이 멈춘 순간, 찰리는 극적으로 살아나지만 동생은 깨어나지 못한다. 상상할 수 없는 슬픔에 빠진 찰리. 그런데 동생 장례식 날 찰리의 눈 앞에 동생의 영혼이 나타난다. 생사의 경계에서 살아 돌아온 찰리에게 자신도 모르는 사이 영혼을 볼 수 있는 신비한 능력이 생겨난 것. 찰리는 외로운 동생과 함께 하기 위해 매일 해가 질 무렵, 공터에서 야구를 하기로 약속한다. 자신의 미래는 모두 포기한 채.  그리고 5년 뒤, 하루도 빠지지 않고 동생과의 약속을 지키며 살아가던 찰리는 매력적이고 활발한 테스를 만난다. 찰리는 세계 요트 대회를 앞둔 테스를 만나면서 잊고 있던 미래에 대한 희망을 되찾고, 그녀와 뜨거운 사랑에 빠진다. 테스는 찰리에게 함께 대회에 나가자고 제안하지만, 이제 찰리는 운명처럼 만난 연인 테스와 동생과의 사이에서 갈등하게 된다. 테스와 함께 고향을 떠난다면, 다시는 동생의 영혼을 만날 수 없기 때문.  그러던 중 테스가 갑작스러운 사고를 당하게 된 걸 알고 찰리는 그녀에게 달려가는데…",18.734,/lFGyipOM0NmfwHaz1Xnq93mtvLr.jpg,2010-07-30,세인트 클라우드,False,7.0,1877
225,False,,[99],241829,en,The Making of The Walking Dead,,8.206,,2010-07-31,The Making of The Walking Dead,False,8.0,118
226,False,/msg5qdBIOceHaNNQfwF4Esa0UVD.jpg,"[12, 28, 16]",50723,ja,劇場版 NARUTO -ナルト- 疾風伝 ザ・ロストタワー,"그 야망을 저지하라!  호카게 츠나데로부터 임무를 받은 나루토는 사쿠라, 야마토와 함께 도망친 닌자 무카데를 쫓아 모래에 가려져있는 폐가 ‘로우란’에 도착한다.  무카데가 노리는 것은 로우란의 지하에 잠들어 있는 ‘용맥’. 결판을 내기 위해 폐허 속 깊은 곳으로 향하는 나루토.  하지만, 무카데에 의해 봉인이 풀린 ‘용맥’의 힘에 삼켜져 버리고 마는데…",98.998,/kMKhM7RUhA4j3yH9oTi1FN8cZJE.jpg,2010-07-31,나루토 질풍전 극장판 4기 - 더 로스트 타워,False,7.0,264
227,False,/3D4nc60RbIVwz7Ga1F9IolfoxIU.jpg,"[16, 10751]",49953,en,A Turtle's Tale: Sammy's Adventures,"캘리포니아 해변에서 태어난 푸른 바다거북이 ‘새미’, 그는 태어나자마자 ‘셸리’와 운명적인 만남을 가지게 되지만 어쩔 수 없이 헤어져 버리는 불행을 겪고 만다.  그러다 새로 만난 친구 ‘레이’와 5대양 6대륙을 누비며 환상적이고 특별한 모험을 시작하는데…",11.496,/7qDFevmDaLyzzAoIjnA3n0DzqBN.jpg,2010-08-03,새미의 어드벤쳐,False,6.0,492
228,False,/gDRlw7GoA0OoLvijXNCTTdtAtNX.jpg,"[53, 12, 28]",27578,en,The Expendables,"바니 로스(실베스터 스텔론)는 두려움도 모르고 찔러도 피 한 방울 나오지 않을 만큼 매정한 용병들의 리더로 그가 유일하게 애정을 갖고 있는 게 있다면 픽업트럭, 수상비행기, 그리고 우직한 용사들로 구성된 그의 팀이다. 전 영국특수부대 SAS 요원이자 칼날 달린 거라면 뭐든 잘 다루는 전문가인 리 크리스마스(제이슨 스태덤), 육탄전의 대가인 잉 양(이 연걸), 무기 전문가인 헤일 시저(테리 크루즈), 노련한 폭파전문가 톨 로드(랜디 커투어), 그리고 정밀 저격의 달인인 군나르 옌슨(돌프 룬드그렌) 등이다.  그러던 어느 날 미스터리 인물, 처치(브루스 윌리스)가 바니에게 아무도 수락하지 않을 만한 일을 권하고 바니와 그의 팀은 늘 해왔던 일처럼 새로운 임무에 착수한다. 바로 ‘빌레나’라는 작은 섬나라에서 살인을 일삼으며 독재자로 군림하고 있는 가자 장군(데이빗 자야스)을 축출하고 주민들을 죽음과 파괴로부터 구하는 것이다. 그러나 전직 CIA요원 제임스 몬로(에릭 로버츠)와 그의 수하 페인(스티브 오스틴)으로 인해 작전은 실패로 돌아가는데…",118.853,/xCLCYks4rikKY9CtqTj7eaS1gVC.jpg,2010-08-03,익스펜더블,False,6.2,6223
229,False,/3cGvyS88UOf3LDUpXf06FpK8crH.jpg,"[28, 53, 80]",51608,ko,아저씨,불행한 사건으로 아내를 잃고 세상을 등진 채 전당포를 꾸려가며 외롭게 살아가는 전직 특수요원 태식. 찾아오는 사람이라곤 전당포에 물건을 맡기러 오는 사람들과 옆집소녀 소미뿐이다. 세상으로부터 버림받은 소미와 함께 보내는 시간이 많아지면서 태식과 소미는 서로 마음을 열며 친구가 되어간다.  그러던 어느 날 소미의 엄마가 범죄단체 연루되고 태식의 눈앞에서 소미가 납치되는데...,66.073,/14QbjXp8m3LN9l1U4SoBWy441kr.jpg,2010-08-04,아저씨,False,7.7,919
230,False,/w5V2vQLPPugskBbB20A5HAS5f9z.jpg,[878],45556,en,Arctic Blast,,11.865,/54JrDQq3ISxwTAHz0yfbFNhBC7f.jpg,2010-08-04,Arctic Blast,False,5.7,112
231,False,/s9KUIs0vFyzjy1bouVcvN7tNbuw.jpg,"[18, 10749]",41233,en,Step Up 3D,"꿈과 사랑, 젊음… 그리고 열정  모든 것을 건 세계 최고의 댄스 배틀이 시작된다!  Stage 1. 목표는 월드잼이다!  뉴욕 최고의 댄스 크루 ‘해적팀’의 리더 루크는 곧 다가올 세계 최고의 댄스배틀 ‘월드 잼’ 준비에 한창이다.  우연히 거리의 댄스 배틀을 구경하던 루크는 최대의 라이벌 ‘사무라이’ 팀을 단숨에 제압해버린 NYU 공대생 무스를 만나게 되고, 부모님의 반대에 망설이던 무스는 타고난 댄스 본능에 이끌려 루크의 팀에 합류하게 된다.  Stage 2. 우리가 추는 춤이 바로 우리를 말해주는 거야!  클럽에서 남다른 댄스실력을 보이던 나탈리를 눈 여겨 봐왔던 루크는 싸움에 휘말린 그녀를 구해 자신의 아지트로 데려온다. 무스와 나탈리까지 합류한 ‘해적팀’은 1차 배틀을 위한 만반의 준비를 갖춘다. 한편, 함께 ‘월드 잼’을 준비하던 나탈리는 자신의 꿈을 위해 노력하는 루크의 모습에 점차 사랑을 느끼게 된다.  Stage 3. 춤에는 무한한 가능성이 있어! 이제부터가 시작이다!!  파워풀한 댄스와 화려한 퍼포먼스로 무대를 장악하며 예선을 통과한 ‘해적팀’은 승리의 기운에 들뜬다. 하지만, 자신들의 비밀 리허설 동영상이 인터넷에 유출되면서 위기를 맞게 되고, 그와 동시에 ‘나탈리’ 마저 갑자기 사라지게 되는데...",26.446,/bq7cYcujwQG0k8ERlA8h45MeNR0.jpg,2010-08-04,스텝 업 3D,False,6.8,1621
232,False,/eLEeH0dFXBuSQ81Y3ESXRJQtJqf.jpg,"[10749, 18]",43949,en,Flipped,"건너편에 이사 온 브라이스를 보고 첫 눈에 사랑을 직감한 7살 줄리. 그 후로 줄리는 브라이스에게 끊임없이 마음을 표현하지만, 나무가 잘리는 걸 막기 위해 시위를 하는 등 남다른 행동을 하는 줄리의 모습이 이상할 뿐이다. 그런 줄리를 요리조리 피해 다니기를 6년. 어느 날, 줄리가 정성들여 키운 닭의 계란을 선물 받고 바로 쓰레기통에 버리던 브라이스의 모습을 줄리에게 들키고 만다. 브라이스는 화가 난 줄리에게 미안함을 느끼며 자꾸 신경이 쓰인다. 철없는 브라이스에 비해, 가난하지만 화목한 가정 속에서 현명하게 살아가는 마음이 예쁜 줄리. 그런 그녀를 보며 사랑임을 확신하는데...",24.28,/rufIMvXhFDREzby1B4s0hHc8Kmr.jpg,2010-08-06,플립,False,7.8,1874
233,False,/nHyri67CN6juBR6hmOefCn9oGf8.jpg,"[35, 28, 80]",27581,en,The Other Guys,테리와 엘렌은 근무 중 저지른 실수로 경찰서 잡무만 떠맡게 된다. 이들은 뉴욕의 수많은 범죄를 해결해 영웅으로 불리던 댄슨과 하이스미스 경찰콤비가 순직하자 그 자리를 차지하려 한다.,61.298,/wNEHNqo3MgHmj3BUiPSqqq5czcm.jpg,2010-08-06,스탠바이 캅,False,6.3,3218
